{
  "schemaId": "iris.context_unit.v3",
  "unitId": "fixture-unit-v3-0001",
  "contextId": "fixture-lineage-v3",
  "contentSchemaId": "iris.semantic.context_message.user.v1",
  "content": {
    "role": "user",
    "content": "v3 unified unit"
  },
  "sourceRef": {
    "schemaId": "iris.dsh_message_ref.v1",
    "sessionId": "fixture-session-v3",
    "messageId": "fixture-message-v3-0001",
    "eventSeq": 3
  },
  "contentHash": "36b329dd27b391bea4277e3522679293fa1161d1fbd0d2205a13f9b5053772f6"
}
